{
  "schema_version": "openguard.notice-license-facts/1",
  "package_status": "draft_facts_only",
  "observed_at": "2026-09-21T01:06:00+08:00",
  "evidence": [
    {"evidence_id":"ev.root.license","kind":"repository_file","locator":"LICENSE","source_url":null,"content_sha256":"c71d239df91726fc519c6eb72d318ec65820627232b2f796219e87dcf35d0ab4","container_sha256":null,"excerpt":"Apache License Version 2.0, January 2004","verification":"repository_bytes_verified"},
    {"evidence_id":"ev.jackson.license","kind":"archive_entry","locator":"com.fasterxml.jackson.core:jackson-databind:2.21.5!/META-INF/LICENSE","source_url":"https://repo1.maven.org/maven2/com/fasterxml/jackson/core/jackson-databind/2.21.5/jackson-databind-2.21.5.jar","content_sha256":"cfc7749b96f63bd31c3c42b5c471bf756814053e847c10f3eb003417bc523d30","container_sha256":"507418c0fafd38b2b2cfb704521630da613a8e4cc8381195a6f418017883e2c0","excerpt":"Apache License Version 2.0, January 2004","verification":"archive_bytes_verified"},
    {"evidence_id":"ev.jackson.notice","kind":"archive_entry","locator":"com.fasterxml.jackson.core:jackson-databind:2.21.5!/META-INF/NOTICE","source_url":"https://repo1.maven.org/maven2/com/fasterxml/jackson/core/jackson-databind/2.21.5/jackson-databind-2.21.5.jar","content_sha256":"612b14bc77c944ce229cbba0d14919162cfea8ed802cbf06a8e865e032d03201","container_sha256":"507418c0fafd38b2b2cfb704521630da613a8e4cc8381195a6f418017883e2c0","excerpt":"Jackson JSON processor; Copyright 2007-, Tatu Saloranta","verification":"archive_bytes_verified"},
    {"evidence_id":"ev.springboot.license","kind":"archive_entry","locator":"org.springframework.boot:spring-boot:4.1.1!/META-INF/LICENSE.txt","source_url":"https://repo1.maven.org/maven2/org/springframework/boot/spring-boot/4.1.1/spring-boot-4.1.1.jar","content_sha256":"7200000367e0e8b47822d563a5ddd2dd3a97cc05b32bd7dbcc7b4eeb92b76628","container_sha256":"0d92b532b1d4020640e72d78c31af175c23db8e0ddd45b81855b7fdf4c9c70f0","excerpt":"Apache License Version 2.0, January 2004","verification":"archive_bytes_verified"},
    {"evidence_id":"ev.springboot.notice","kind":"archive_entry","locator":"org.springframework.boot:spring-boot:4.1.1!/META-INF/NOTICE.txt","source_url":"https://repo1.maven.org/maven2/org/springframework/boot/spring-boot/4.1.1/spring-boot-4.1.1.jar","content_sha256":"64e8c092d64ccaecac2d81d324c84a4dff29fdc2cb777f3b1abd910ac2e8555d","container_sha256":"0d92b532b1d4020640e72d78c31af175c23db8e0ddd45b81855b7fdf4c9c70f0","excerpt":"Spring Boot 4.1.1; Copyright (c) 2012-2026 VMware, Inc.","verification":"archive_bytes_verified"},
    {"evidence_id":"ev.hamcrest.license","kind":"archive_entry","locator":"org.hamcrest:hamcrest:3.0!/META-INF/LICENSE","source_url":"https://repo1.maven.org/maven2/org/hamcrest/hamcrest/3.0/hamcrest-3.0.jar","content_sha256":"1710cf0fc79043bb1ea1e6b3af96a3e8def96c4239794a17b0b95966e75929b8","container_sha256":"5d66b6a4a680755cb6ed7cb104fa7835ef644667586ff0737adeb977c39ecdbc","excerpt":"BSD 3-Clause License; Copyright (c) 2000-2024, www.hamcrest.org","verification":"archive_bytes_verified"},
    {"evidence_id":"ev.mockito.license","kind":"archive_entry","locator":"org.mockito:mockito-core:5.23.0!/LICENSE","source_url":"https://repo1.maven.org/maven2/org/mockito/mockito-core/5.23.0/mockito-core-5.23.0.jar","content_sha256":"fc37ea05c14706d13ec54d477a5c8c456aec1a5393779c683404b0151d04d7d7","container_sha256":"ae295bebd5d11fab97ab297815dc7617188b86003cbce3dfd5c0d5c3a6cc4a0c","excerpt":"The MIT License; Copyright (c) 2007 Mockito contributors","verification":"archive_bytes_verified"},
    {"evidence_id":"ev.hf.gpt2.license","kind":"provider_snapshot","locator":"tests/fixtures/huggingface/resource-profile-v1/snapshots/models/openai-community--gpt2.json#/payload/cardData/license","source_url":"https://huggingface.co/api/models/openai-community/gpt2","content_sha256":"2e1ba694ae9f2afb6e46867c73215739dab87bcf0e0d69816d63ecefafd075f9","container_sha256":null,"excerpt":"Provider-declared raw value: mit","verification":"fixture_bytes_verified"},
    {"evidence_id":"ev.hf.bert.license","kind":"provider_snapshot","locator":"tests/fixtures/huggingface/resource-profile-v1/snapshots/models/google-bert--bert-base-uncased.json#/payload/cardData/license","source_url":"https://huggingface.co/api/models/google-bert/bert-base-uncased","content_sha256":"dc293e547c6cb125a94305654420a49aa3d930b39bd55309bd8e323b0ce865dc","container_sha256":null,"excerpt":"Provider-declared raw value: apache-2.0","verification":"fixture_bytes_verified"},
    {"evidence_id":"ev.hf.imdb.license","kind":"provider_snapshot","locator":"tests/fixtures/huggingface/resource-profile-v1/snapshots/datasets/stanfordnlp--imdb.json#/payload/cardData/license","source_url":"https://huggingface.co/api/datasets/stanfordnlp/imdb","content_sha256":"3d49996e64d52e01a6085382bb1c706489c3fda0422fcfa4a03658eb502c8766","container_sha256":null,"excerpt":"Provider-declared raw value: [other]","verification":"fixture_bytes_verified"}
  ],
  "facts": [
    {"fact_id":"fact.root.openguard","subject":{"category":"root_project","canonical_id":"openguard","display_name":"OpenGuard","version":null,"source_url":null,"usage_scope":"project"},"license_observations":[{"raw_value":"Apache License Version 2.0","observation_kind":"license_text_heading","evidence_ids":["ev.root.license"],"license_expression_id":null}],"relationships":{"license":{"state":"observed","evidence_ids":["ev.root.license"],"gap_code":null},"notice":{"state":"gap","evidence_ids":[],"gap_code":"GAP_ROOT_NOTICE_MISSING"},"copyright":{"state":"gap","evidence_ids":[],"gap_code":"GAP_ROOT_COPYRIGHT_SOURCE_MISSING"}},"gaps":["GAP_ROOT_NOTICE_MISSING","GAP_ROOT_COPYRIGHT_SOURCE_MISSING"],"review_status":"pending_human_review"},
    {"fact_id":"fact.dep.jackson-databind","subject":{"category":"dependency","canonical_id":"pkg:maven/com.fasterxml.jackson.core/jackson-databind@2.21.5","display_name":"Jackson Databind","version":"2.21.5","source_url":"https://github.com/FasterXML/jackson-databind","usage_scope":"runtime"},"license_observations":[{"raw_value":"Apache License Version 2.0","observation_kind":"license_text_heading","evidence_ids":["ev.jackson.license"],"license_expression_id":null}],"relationships":{"license":{"state":"observed","evidence_ids":["ev.jackson.license"],"gap_code":null},"notice":{"state":"observed","evidence_ids":["ev.jackson.notice"],"gap_code":null},"copyright":{"state":"observed","evidence_ids":["ev.jackson.notice"],"gap_code":null}},"gaps":[],"review_status":"pending_human_review"},
    {"fact_id":"fact.dep.springboot","subject":{"category":"dependency","canonical_id":"pkg:maven/org.springframework.boot/spring-boot@4.1.1","display_name":"Spring Boot","version":"4.1.1","source_url":"https://github.com/spring-projects/spring-boot","usage_scope":"runtime"},"license_observations":[{"raw_value":"Apache License Version 2.0","observation_kind":"license_text_heading","evidence_ids":["ev.springboot.license"],"license_expression_id":null}],"relationships":{"license":{"state":"observed","evidence_ids":["ev.springboot.license"],"gap_code":null},"notice":{"state":"observed","evidence_ids":["ev.springboot.notice"],"gap_code":null},"copyright":{"state":"observed","evidence_ids":["ev.springboot.notice"],"gap_code":null}},"gaps":[],"review_status":"pending_human_review"},
    {"fact_id":"fact.dep.hamcrest","subject":{"category":"dependency","canonical_id":"pkg:maven/org.hamcrest/hamcrest@3.0","display_name":"Hamcrest","version":"3.0","source_url":"https://github.com/hamcrest/JavaHamcrest","usage_scope":"test"},"license_observations":[{"raw_value":"BSD 3-Clause License","observation_kind":"license_text_heading","evidence_ids":["ev.hamcrest.license"],"license_expression_id":null}],"relationships":{"license":{"state":"observed","evidence_ids":["ev.hamcrest.license"],"gap_code":null},"notice":{"state":"gap","evidence_ids":[],"gap_code":"GAP_NOTICE_NOT_PACKAGED"},"copyright":{"state":"observed","evidence_ids":["ev.hamcrest.license"],"gap_code":null}},"gaps":["GAP_NOTICE_NOT_PACKAGED"],"review_status":"pending_human_review"},
    {"fact_id":"fact.dep.mockito","subject":{"category":"dependency","canonical_id":"pkg:maven/org.mockito/mockito-core@5.23.0","display_name":"Mockito Core","version":"5.23.0","source_url":"https://github.com/mockito/mockito","usage_scope":"test"},"license_observations":[{"raw_value":"The MIT License","observation_kind":"license_text_heading","evidence_ids":["ev.mockito.license"],"license_expression_id":null}],"relationships":{"license":{"state":"observed","evidence_ids":["ev.mockito.license"],"gap_code":null},"notice":{"state":"gap","evidence_ids":[],"gap_code":"GAP_NOTICE_NOT_PACKAGED"},"copyright":{"state":"observed","evidence_ids":["ev.mockito.license"],"gap_code":null}},"gaps":["GAP_NOTICE_NOT_PACKAGED"],"review_status":"pending_human_review"},
    {"fact_id":"fact.ai.gpt2","subject":{"category":"ai_resource","canonical_id":"huggingface:model:openai-community/gpt2","display_name":"openai-community/gpt2","version":"607a30d783dfa663caf39e06633721c8d4cfcd7e","source_url":"https://huggingface.co/openai-community/gpt2","usage_scope":"model"},"license_observations":[{"raw_value":"mit","observation_kind":"provider_declared_raw","evidence_ids":["ev.hf.gpt2.license"],"license_expression_id":null}],"relationships":{"license":{"state":"observed","evidence_ids":["ev.hf.gpt2.license"],"gap_code":null},"notice":{"state":"gap","evidence_ids":[],"gap_code":"GAP_AI_NOTICE_NOT_OBSERVED"},"copyright":{"state":"gap","evidence_ids":[],"gap_code":"GAP_AI_COPYRIGHT_NOT_OBSERVED"}},"gaps":["GAP_AI_NOTICE_NOT_OBSERVED","GAP_AI_COPYRIGHT_NOT_OBSERVED","GAP_AI_LICENSE_TEXT_NOT_VERIFIED"],"review_status":"pending_human_review"},